{
  "$schema": "https://json-schema.org/draft/2020-12/schema",
  "$id": "https://contracts.kaas.dev/sandbox-security-attestation.schema.json",
  "title": "SandboxSecurityAttestation",
  "description": "Evidence that a deployment's sandbox enforces the controls the control plane requires before it will authorize any execution, SIGNED by the gate that made the observations. This is the bridge between two modules that deliberately cannot see each other: the hostile-execution gate holds container-runtime access and lives in services/runner, and the control plane is build-guarded against depending on it, so the gate's verdict travels as this document rather than as a method call. It is emphatically NOT a boolean, and since v3 it is emphatically not a self-consistency check either: a SHA-256 over a document's own content proves only that the document matches its own digest, which an operator recomputing it after typing the verdicts satisfies trivially. The signature is Ed25519 over the canonical preimage defined in sandbox-security-attestation-signing.md \u2014 NOT over this JSON, whose field order and whitespace must never define security semantics \u2014 and the control plane verifies it against a key it has pinned before reading a single verdict. No API accepts one and none registers a verification key: the artifact arrives as deployment configuration, so nothing that authenticates to the control plane can assert its own security posture or nominate who may vouch for it.",
  "type": "object",
  "required": [
    "schemaVersion",
    "attestationId",
    "producerVersion",
    "keyId",
    "signatureAlgorithm",
    "securityProfileVersion",
    "runtime",
    "sandboxRuntime",
    "runtimeSubject",
    "runtimeGeneration",
    "runtimeImplementationName",
    "runtimeImplementationVersion",
    "runtimeImplementationDigest",
    "runtimeImplementationPath",
    "probeImageDigest",
    "assessedAt",
    "mandatoryControls",
    "egressControls",
    "payloadDigest",
    "signature"
  ],
  "properties": {
    "schemaVersion": {
      "const": "kaas.sandbox-security-attestation.v5"
    },
    "securityProfileVersion": {
      "type": "string",
      "minLength": 1,
      "maxLength": 64,
      "description": "Which sandbox security profile was assessed. An assessment for a different profile describes a different boundary and is refused."
    },
    "probeImageDigest": {
      "$ref": "#/$defs/digest",
      "description": "The content address of the probe image the assessment ran. A tag would be a mutable pointer to executable code."
    },
    "runtime": {
      "type": "string",
      "minLength": 1,
      "maxLength": 64,
      "description": "The container runtime the assessment ran against. Recorded and covered by the digest, but NOT currently compared against anything by the control plane \u2014 there is no configured expected runtime to compare it to. It is provenance for a human reading an audit trail, not a check, and this description says so rather than implying enforcement that does not exist."
    },
    "sandboxRuntime": {
      "type": "string",
      "enum": [
        "DOCKER",
        "GVISOR"
      ],
      "description": "Which sandbox runtime served the probes, as the platform's own runtime constant. Unlike `runtime`, this IS compared: it must be the runtime that `securityProfileVersion` implies, per runtimeByProfileVersion in mandatory-sandbox-controls.json, and a document whose two answers disagree is refused rather than resolved in favour of either. Closed enum because a runtime name is the name of a program a daemon will execute, and nothing a document supplies may widen that set."
    },
    "runtimeImplementationName": {
      "type": "string",
      "minLength": 1,
      "maxLength": 64,
      "description": "The daemon runtime name whose binary was measured, e.g. runsc. Names WHICH registration the three fields below describe, so a document cannot be read as measuring a runtime it did not."
    },
    "runtimeImplementationVersion": {
      "type": "string",
      "minLength": 1,
      "maxLength": 200,
      "pattern": "^[\\x20-\\x7E]+$",
      "description": "What the sandbox runtime reports as its own version, read by executing the binary the daemon registered. Bounded and restricted to printable ASCII because it is a program's stdout: a runtime that printed control characters must not put them into signed evidence."
    },
    "runtimeImplementationDigest": {
      "type": "string",
      "pattern": "^sha256:[a-f0-9]{64}$",
      "description": "SHA-256 of the sandbox runtime binary the daemon will invoke, measured from the daemon's own runtime registration rather than from PATH or from an operator-supplied value. This is the field that stops evidence gathered against one build of the runtime from authorizing execution under another; the control plane compares it against the implementations it was configured to accept."
    },
    "runtimeImplementationPath": {
      "type": "string",
      "pattern": "^path:[a-f0-9]{32}$",
      "description": "An opaque hash covering both the configured runtime path and its resolved target. Hashed rather than published because a host path describes the host and the artifact travels; it is present so that repointing a symlink at a different build changes the evidence even when the previous binary still exists elsewhere."
    },
    "assessedAt": {
      "type": "string",
      "format": "date-time",
      "description": "When the assessment was taken. Freshness is enforced against database time, because this describes a running host rather than a source tree: a host reconfigured after the assessment is not described by it."
    },
    "mandatoryControls": {
      "type": "object",
      "minProperties": 1,
      "maxProperties": 64,
      "propertyNames": {
        "pattern": "^[A-Z][A-Z0-9_]{2,63}$"
      },
      "additionalProperties": {
        "enum": [
          "PASS",
          "FAIL",
          "UNSUPPORTED"
        ]
      },
      "description": "Every mandatory control and its verdict. The control plane requires EXACT set equality against the controls it independently demands, in both directions: containment would let a truncated assessment pass by omitting the control it failed, and would let a build accept an assessment produced for a weaker control set. Since v3 this carries ONLY controls whose enforcement is MANDATORY: the gate also observes deployment-specific hardening, which is never required, and including it here made every attestation fail the exact-coverage check while naming a control nothing demands."
    },
    "egressControls": {
      "type": "object",
      "minProperties": 0,
      "maxProperties": 64,
      "propertyNames": {
        "pattern": "^[A-Z][A-Z0-9_]{2,63}$"
      },
      "additionalProperties": {
        "enum": [
          "PASS",
          "FAIL",
          "UNSUPPORTED"
        ]
      },
      "description": "Whether this deployment can enforce a destination allowlist, control by control. REQUIRED to be present since v3 and permitted to be EMPTY, which is the shape of an assessment that makes no egress claim: such an assessment is refused for an ALLOWLIST execution and entirely unaffected for a DENY_ALL one. That is why it is a separate set from mandatoryControls rather than more entries in it \u2014 the two are demanded under different conditions, and requiring these of a run that wants no network would make it depend on a subsystem it does not use. Within its own scope the same exact-set-equality rule applies, and every control must PASS."
    },
    "attestationId": {
      "type": "string",
      "minLength": 1,
      "maxLength": 128,
      "description": "Opaque identifier for this statement, unique per production. Safe to log and to correlate against a control plane's verification outcome; it identifies the statement rather than the evidence, so two attestations of identical evidence differ here."
    },
    "producerVersion": {
      "type": "string",
      "minLength": 1,
      "maxLength": 64,
      "description": "Which producer built this, so a defect in one can be traced to the artifacts it produced."
    },
    "keyId": {
      "type": "string",
      "minLength": 1,
      "maxLength": 64,
      "description": "Selects ONE key from the verifier's pinned trust map. It is not itself authority: an unknown id is refused, and a verifier must never try its other trusted keys to see whether one happens to work. It is inside the signed preimage, so the signer commits to which key it used."
    },
    "signatureAlgorithm": {
      "const": "ED25519",
      "description": "Compared for equality and never dispatched on. A verifier that looked up an algorithm the document named would let the document choose how it is checked."
    },
    "runtimeSubject": {
      "type": "string",
      "minLength": 1,
      "maxLength": 128,
      "description": "An OPAQUE operator-assigned label for the runtime this evidence describes, configured on both sides. Never a hostname, MAC address, machine serial, cloud instance id, or host path \u2014 this artifact travels. The control plane validates it against the set of subjects it accepts; merely displaying it would let one signature authorize every runtime that key ever signed for."
    },
    "runtimeGeneration": {
      "type": "string",
      "pattern": "^gen:[a-f0-9]{32}$",
      "description": "An opaque hash of the container runtime's own instance identity, so two attestations from different runtime instances are distinguishable. It is NOT reboot invalidation: a daemon's identity ordinarily survives a host restart, and freshness is bounded by assessedAt and the configured maximum age alone."
    },
    "egressProxyImageDigest": {
      "$ref": "#/$defs/digest",
      "description": "The content address of the egress proxy image the egress assessment ran. OPTIONAL, and absent exactly when there is no egress evidence \u2014 the preimage distinguishes absent from empty, so an artifact cannot lose its proxy image identity silently. EGRESS_PROXY_IMAGE_PINNED=PASS says an image was pinned; only this says which."
    },
    "payloadDigest": {
      "$ref": "#/$defs/digest",
      "description": "SHA-256 over the canonical preimage, NOT over this JSON. Recomputed by the verifier from the reconstructed payload and compared, never trusted. It is outside the signed preimage because a payload cannot contain its own digest without circularity, and it is what ExecutionCommand binds as assessmentDigest."
    },
    "signature": {
      "type": "string",
      "pattern": "^[A-Za-z0-9+/]{86}==$",
      "description": "Ed25519 signature over the canonical preimage, standard Base64 with padding \u2014 not base64url, not unpadded, not MIME. 64 bytes, so exactly 88 Base64 characters. Verified over the preimage the verifier RECONSTRUCTS from the parsed fields, never over the bytes as received: verifying received bytes would authenticate a serialization, and a field the verifier does not understand would be signed over without ever being read."
    }
  },
  "additionalProperties": false,
  "$defs": {
    "digest": {
      "type": "string",
      "pattern": "^sha256:[a-f0-9]{64}$"
    }
  }
}
