{
  "schemaVersion": "kaas.sandbox-security-attestation.v5",
  "attestationId": "01JBQZ8V4T0000000000000001",
  "producerVersion": "kaas.attestation-producer.v1",
  "keyId": "kaas-test-key-1",
  "signatureAlgorithm": "ED25519",
  "securityProfileVersion": "kaas.sandbox.v1",
  "runtime": "docker",
  "sandboxRuntime": "DOCKER",
  "runtimeSubject": "kaas.runtime.vector",
  "runtimeGeneration": "gen:0123456789abcdef0123456789abcdef",
  "runtimeImplementationName": "runsc",
  "runtimeImplementationVersion": "runsc version release-20260817.0",
  "runtimeImplementationDigest": "sha256:aaaaaaaaaaaaaaaaaaaaaaaaaaaaaaaaaaaaaaaaaaaaaaaaaaaaaaaaaaaaaaaa",
  "runtimeImplementationPath": "path:cccccccccccccccccccccccccccccccc",
  "probeImageDigest": "sha256:1111111111111111111111111111111111111111111111111111111111111111",
  "assessedAt": "2026-09-05T09:12:33Z",
  "mandatoryControls": {
    "CAPABILITIES_DROPPED": "PASS",
    "KERNEL_PATHS_MASKED": "PASS",
    "MEMORY_LIMIT": "PASS",
    "MINIMAL_ENVIRONMENT": "PASS",
    "NETWORK_DENIED": "PASS",
    "NON_ROOT_GID": "PASS",
    "NON_ROOT_UID": "PASS",
    "NO_DOCKER_SOCKET": "PASS",
    "NO_HOST_DEVICES": "PASS",
    "NO_HOST_MOUNTS": "PASS",
    "NO_NEW_PRIVILEGES": "PASS",
    "NO_SETUID_BINARIES": "PASS",
    "OUTPUT_BOUNDED": "PASS",
    "PID_LIMIT": "PASS",
    "READ_ONLY_ROOT": "PASS",
    "WALL_CLOCK_TIMEOUT": "PASS",
    "WRITABLE_TMPFS": "PASS"
  },
  "egressControls": {},
  "payloadDigest": "sha256:8e9ae71d2414cc429d51c4d9c8af56b12eaf4f44a6c405a93621e31bd17200be",
  "signature": "/Olf4ZL3j8pkwVfluAzBbghHFqi+7KK+P6vIGVGsPIepiTgvDdgIf7dtIr8RYlsaY+BHAxHUG51S5hrs34niDw=="
}
