{
  "schemaVersion": "kaas.sandbox-security-attestation.v5",
  "attestationId": "01JBQZ8V4T0000000000000001",
  "producerVersion": "kaas.attestation-producer.v1",
  "keyId": "kaas-test-key-1",
  "signatureAlgorithm": "ED25519",
  "securityProfileVersion": "kaas.sandbox.v1",
  "runtime": "docker",
  "runtimeSubject": "kaas.runtime.vector",
  "runtimeGeneration": "gen:0123456789abcdef0123456789abcdef",
  "runtimeImplementationName": "runsc",
  "runtimeImplementationVersion": "runsc version release-20260817.0",
  "runtimeImplementationDigest": "sha256:aaaaaaaaaaaaaaaaaaaaaaaaaaaaaaaaaaaaaaaaaaaaaaaaaaaaaaaaaaaaaaaa",
  "runtimeImplementationPath": "path:cccccccccccccccccccccccccccccccc",
  "probeImageDigest": "sha256:1111111111111111111111111111111111111111111111111111111111111111",
  "egressProxyImageDigest": "sha256:2222222222222222222222222222222222222222222222222222222222222222",
  "assessedAt": "2026-09-05T09:12:33Z",
  "mandatoryControls": {
    "CAPABILITIES_DROPPED": "PASS",
    "KERNEL_PATHS_MASKED": "PASS",
    "MEMORY_LIMIT": "PASS",
    "MINIMAL_ENVIRONMENT": "PASS",
    "NETWORK_DENIED": "PASS",
    "NON_ROOT_GID": "PASS",
    "NON_ROOT_UID": "PASS",
    "NO_DOCKER_SOCKET": "PASS",
    "NO_HOST_DEVICES": "PASS",
    "NO_HOST_MOUNTS": "PASS",
    "NO_NEW_PRIVILEGES": "PASS",
    "NO_SETUID_BINARIES": "PASS",
    "OUTPUT_BOUNDED": "PASS",
    "PID_LIMIT": "PASS",
    "READ_ONLY_ROOT": "PASS",
    "WALL_CLOCK_TIMEOUT": "PASS",
    "WRITABLE_TMPFS": "PASS"
  },
  "egressControls": {
    "EGRESS_NETWORK_INTERNAL": "PASS",
    "EGRESS_NO_DIRECT_ROUTE": "PASS",
    "EGRESS_PROXY_FAILS_CLOSED": "PASS",
    "EGRESS_PROXY_IMAGE_PINNED": "PASS",
    "EGRESS_PROXY_READY": "PASS"
  },
  "payloadDigest": "sha256:149af67ffaaed2da68072fc1683bbfac3aac9be3d1f2349abbab9e6a057318ac",
  "signature": "ZXbw+SX+IGIG9Zl8oK5v5YV/64KqSfoygWWSCufUoX0tZOPy673Jwlf2iZQagiRcWGsQRnCzF12S+naIBFRDDg==",
  "sandboxRuntime": "DOCKER"
}
